{
  "id": "progress-stepper",
  "name": "Progress stepper",
  "purpose": "Numbered nodes on a rule that fill as a process advances (recipe steps, setup stages, chapters), so the viewer always knows where they are and how much is left on a single persistent stage.",
  "status": "experimental",
  "uses": {
    "primitives": ["styled-text", "svg-shape"],
    "effects": ["paper-pop"],
    "recipes": ["paper-pop-in"]
  },
  "formats_supported": ["landscape", "portrait", "square"],
  "inputs": [
    { "name": "steps", "type": "string[]", "description": "Step labels (short; 3-7 steps)" },
    { "name": "labels", "type": "boolean", "default": true, "description": "Show labels under the nodes" }
  ],
  "implementation": {
    "location": "src/studio/studio-compositions.js",
    "api": "Studio.comp.stepper(parent, steps, {labels}) -> {enter(tl, at), advance(tl, index, at), exit(tl, at)}"
  },
  "layout_notes": "Spans its parent's width with equal columns; the rule runs between the first and last node centres. With more than 5 steps in portrait, shorten labels or pass labels:false and name the step elsewhere.",
  "styles_tested": ["editorial-light"],
  "examples": ["projects/paper-plane-field-notes/src/index.html", "tests/studio-runtime/reference-techniques.html"],
  "validation_steps": [
    "python tests/test-studio-runtime.py",
    "python scripts/frame-review.py <project> --fonts google"
  ],
  "validation": {
    "evidence": "Runtime self-test (earlier nodes completed, rule filled to the current node) in Playwright Chromium on Windows, 2026-10-30.",
    "last_verified": "2026-10-30"
  },
  "related": ["step-header", "item-list"],
  "tags": ["composition", "stepper", "progress", "recipe", "how-to", "reference-derived"],
  "metadata": { "author": "MotionLab", "created_at": "2026-10-30", "updated_at": "2026-10-30" }
}
