{
  "id": "word-beats",
  "name": "Word beats (one word per beat)",
  "purpose": "Kinetic sentence or manifesto delivered one word per cut, each word on its own full-frame card with a treatment that performs the word (rise, smear, drop, stretch, spin, track, echo, cut) and an optional accent full stop.",
  "status": "experimental",
  "uses": {
    "primitives": ["split-text", "styled-text", "clip-mask"],
    "effects": ["text-mask-rise", "char-cascade", "tracking-reveal", "smear-motion", "beat-pulse"],
    "recipes": ["line-mask-rise", "char-cascade-drop", "tracking-settle", "smear-entrance", "bpm-grid-pulse"]
  },
  "formats_supported": ["landscape", "portrait", "square"],
  "inputs": [
    { "name": "words", "type": "array", "description": "[{text, treatment, bg, ink, accent, side, stretch}]; stretch is the start scaleX of the 'stretch' treatment (2.6); lower it when frame 0 must stay inside narrow formats" },
    { "name": "beats", "type": "number[] | {start, bpm, every}", "description": "One time per word plus the end, or a tempo grid" },
    { "name": "holdLast", "type": "boolean", "default": false, "description": "Keep the last card visible after its beat" },
    { "name": "fit", "type": "boolean", "default": true, "description": "Shrink each word to the safe width" }
  ],
  "implementation": {
    "location": "src/studio/studio-compositions.js",
    "api": "Studio.comp.wordBeats(parent, words, {beats, holdLast, fit}).schedule(tl) -> end time"
  },
  "layout_notes": "Each card fills its parent; the word is centred and fitted to the safe width of the current format (Studio.type.fit), so portrait gets a smaller size rather than a crop. Background and ink per card come from style tokens or explicit colours.",
  "styles_tested": ["editorial-light", "swiss-minimal"],
  "examples": ["tests/reference-derived/word-beats/index.html", "tests/studio-runtime/reference-techniques.html"],
  "validation_steps": [
    "python tests/test-studio-runtime.py",
    "python scripts/frame-review.py tests/reference-derived/word-beats/index.html --fonts google (check every card is readable for its beat)",
    "npx hyperframes check on the render host"
  ],
  "validation": {
    "evidence": "Runtime self-test (exactly one card per beat, tempo-grid timing, accent dot, echo copies, last card holds) in Playwright Chromium on Windows, 2026-10-30.",
    "last_verified": "2026-10-30"
  },
  "related": ["title-card", "caption-band"],
  "tags": ["composition", "kinetic-typography", "word", "beat", "manifesto", "reference-derived"],
  "metadata": { "author": "MotionLab", "created_at": "2026-10-30", "updated_at": "2026-10-30" }
}
